id,name,neighborhood,cuisine,price_level,rating,review_count,is_open,hours,tags,description,menu_summary,top_reviews,vibe
6JTdvsp-7k9gMDTaD3MnUA,Pho and Roll Vietnamese Kitchen,Unknown,Vietnamese,2.0,4.3,63,True,"[{'is_overnight': False, 'start': '1100', 'end': '1500', 'day': 0}, {'is_overnight': False, 'start': '1600', 'end': '2100', 'day': 0}, {'is_overnight': False, 'start': '1100', 'end': '1500', 'day': 1}, {'is_overnight': False, 'start': '1600', 'end': '2100', 'day': 1}, {'is_overnight': False, 'start': '1100', 'end': '1500', 'day': 2}, {'is_overnight': False, 'start': '1600', 'end': '2100', 'day': 2}, {'is_overnight': False, 'start': '1100', 'end': '1500', 'day': 3}, {'is_overnight': False, 'start': '1600', 'end': '2100', 'day': 3}, {'is_overnight': False, 'start': '1100', 'end': '1500', 'day': 4}, {'is_overnight': False, 'start': '1600', 'end': '2100', 'day': 4}, {'is_overnight': False, 'start': '1100', 'end': '1500', 'day': 5}, {'is_overnight': False, 'start': '1600', 'end': '2100', 'day': 5}, {'is_overnight': False, 'start': '1100', 'end': '1500', 'day': 6}, {'is_overnight': False, 'start': '1600', 'end': '2100', 'day': 6}]",Vietnamese,"Pho and Roll Vietnamese Kitchen is a Vietnamese restaurant, but I don't have enough information to provide a meaningful description without any reviews available.","Based on the name, the restaurant likely serves Vietnamese cuisine with a focus on pho noodle soups and fresh spring rolls. However, without a menu or reviews I cannot say definitively what dishes are offered.","No Yelp reviews were found for this restaurant, so I don't have insight into what customers liked or disliked about their experience.","Without reviews describing the atmosphere, I don't have enough context to accurately characterize the vibe or ambiance of the restaurant."
WZDQqw960DaMWDyPbtRFtA,Dancing Crab Thai Noodle House,Unknown,Thai,2.0,4.4,367,True,"[{'is_overnight': False, 'start': '1130', 'end': '2100', 'day': 1}, {'is_overnight': False, 'start': '1130', 'end': '2100', 'day': 2}, {'is_overnight': False, 'start': '1130', 'end': '2100', 'day': 3}, {'is_overnight': False, 'start': '1130', 'end': '2200', 'day': 4}, {'is_overnight': False, 'start': '1130', 'end': '2200', 'day': 5}, {'is_overnight': False, 'start': '1130', 'end': '2100', 'day': 6}]",Thai,,,,
6Yl6KXmao86T2kUcOgWKwA,Mezcal Mexican Cantina,Unknown,"Mexican, Bars",2.0,4.3,60,True,"[{'is_overnight': False, 'start': '1500', 'end': '2200', 'day': 0}, {'is_overnight': False, 'start': '1500', 'end': '2200', 'day': 1}, {'is_overnight': False, 'start': '1500', 'end': '2200', 'day': 2}, {'is_overnight': False, 'start': '1500', 'end': '2200', 'day': 3}, {'is_overnight': False, 'start': '1500', 'end': '0000', 'day': 4}, {'is_overnight': False, 'start': '1200', 'end': '0000', 'day': 5}]","Mexican, Bars",Mezcal Mexican Cantina is a bar and restaurant serving Mexican cuisine.,"The menu likely features traditional Mexican dishes and a selection of mezcal and tequila-based cocktails, given the name.",No Yelp reviews were found for this restaurant.,Cantina-style
Omg0Pj1ZxABTgy_mB5vwiA,One By Spork,Unknown,Pop-Up Restaurants,,5.0,5,True,"[{'is_overnight': False, 'start': '1800', 'end': '2100', 'day': 3}, {'is_overnight': False, 'start': '1800', 'end': '2100', 'day': 4}, {'is_overnight': False, 'start': '1800', 'end': '2100', 'day': 5}, {'is_overnight': False, 'start': '1800', 'end': '2100', 'day': 6}]",Pop-Up Restaurants,One By Spork is a pop-up restaurant concept. No further details are available due to a lack of reviews or additional information.,"Unknown, as no menu details or reviews could be found.",No reviews are available for One By Spork at this time.,Uncertain due to insufficient information.
QzvQE0obBOAJxhZx1kghwg,Amazing Dumplings,Unknown,"Chinese, Noodles, Soup",,4.4,72,True,"[{'is_overnight': False, 'start': '1100', 'end': '2100', 'day': 0}, {'is_overnight': False, 'start': '1100', 'end': '2100', 'day': 2}, {'is_overnight': False, 'start': '1100', 'end': '2100', 'day': 3}, {'is_overnight': False, 'start': '1100', 'end': '2130', 'day': 4}, {'is_overnight': False, 'start': '1100', 'end': '2130', 'day': 5}, {'is_overnight': False, 'start': '1100', 'end': '2100', 'day': 6}]","Chinese, Noodles, Soup","Amazing Dumplings is a Chinese restaurant specializing in dumplings, noodles and soups.","The menu focuses on Chinese dumplings, various noodle dishes, and soups. Specific menu items are unknown due to lack of reviews.","No Yelp reviews were found for Amazing Dumplings, so reviewer opinions on the food, service and atmosphere are unavailable.",Unknown
S6dARuOrrOXd4xSiTHti8g,Chengdu Gourmet,Unknown,Chinese,2.0,3.8,305,True,"[{'is_overnight': False, 'start': '1100', 'end': '1500', 'day': 0}, {'is_overnight': False, 'start': '1600', 'end': '2130', 'day': 0}, {'is_overnight': False, 'start': '1100', 'end': '1500', 'day': 1}, {'is_overnight': False, 'start': '1600', 'end': '2130', 'day': 1}, {'is_overnight': False, 'start': '1100', 'end': '1500', 'day': 2}, {'is_overnight': False, 'start': '1600', 'end': '2130', 'day': 2}, {'is_overnight': False, 'start': '1100', 'end': '1500', 'day': 3}, {'is_overnight': False, 'start': '1600', 'end': '2130', 'day': 3}, {'is_overnight': False, 'start': '1100', 'end': '2230', 'day': 4}, {'is_overnight': False, 'start': '1100', 'end': '2230', 'day': 5}, {'is_overnight': False, 'start': '1100', 'end': '2130', 'day': 6}]",Chinese,,,,
SvCjBtbN1cKElDKPTw9dOA,Monterey Bay Fish Grotto,Unknown,"Seafood, Bars, Venues & Event Spaces",3.0,4.2,787,True,"[{'is_overnight': False, 'start': '1630', 'end': '2100', 'day': 0}, {'is_overnight': False, 'start': '1630', 'end': '2100', 'day': 1}, {'is_overnight': False, 'start': '1630', 'end': '2100', 'day': 2}, {'is_overnight': False, 'start': '1630', 'end': '2100', 'day': 3}, {'is_overnight': False, 'start': '1630', 'end': '2200', 'day': 4}, {'is_overnight': False, 'start': '1630', 'end': '2200', 'day': 5}, {'is_overnight': False, 'start': '1630', 'end': '2100', 'day': 6}]","Seafood, Bars, Venues & Event Spaces",Monterey Bay Fish Grotto is a seafood restaurant and bar that also hosts events.,"The menu focuses on seafood dishes, along with drinks from the bar.",No Yelp reviews were found for this restaurant.,Seafood-focused
bxxMdqY8lXDwCm-OApUSzw,Severina,Unknown,"Pizza, Italian, Coffee & Tea",2.0,4.4,173,True,"[{'is_overnight': False, 'start': '0800', 'end': '2100', 'day': 1}, {'is_overnight': False, 'start': '0800', 'end': '2100', 'day': 2}, {'is_overnight': False, 'start': '0800', 'end': '2100', 'day': 3}, {'is_overnight': False, 'start': '0800', 'end': '2100', 'day': 4}, {'is_overnight': False, 'start': '0800', 'end': '2100', 'day': 5}]","Pizza, Italian, Coffee & Tea","Severina is a local Italian restaurant serving pizza, coffee and tea. No Yelp reviews are available yet for this establishment.","The menu focuses on Italian cuisine, featuring pizza as well as coffee and tea options.",No reviews are currently available on Yelp to summarize what diners liked or disliked about their experience at Severina.,Unknown
VBhPgceaKWOXT71d3Jp38w,Soba,Unknown,"Asian Fusion, Japanese, Korean",3.0,4.0,523,True,"[{'is_overnight': False, 'start': '1630', 'end': '2100', 'day': 0}, {'is_overnight': False, 'start': '1630', 'end': '2100', 'day': 1}, {'is_overnight': False, 'start': '1630', 'end': '2100', 'day': 2}, {'is_overnight': False, 'start': '1630', 'end': '2100', 'day': 3}, {'is_overnight': False, 'start': '1630', 'end': '2200', 'day': 4}, {'is_overnight': False, 'start': '1630', 'end': '2200', 'day': 5}, {'is_overnight': False, 'start': '1630', 'end': '2100', 'day': 6}]","Asian Fusion, Japanese, Korean",Soba is an Asian fusion restaurant serving Japanese and Korean inspired cuisine. No Yelp reviews are available to provide additional details.,"The menu likely features soba noodle dishes as well as other Japanese and Korean specialties. Expect to find items like sushi, bibimbap, ramen, and other popular dishes from those cuisines.","No Yelp reviews were found for this restaurant, so there is no information available on what diners liked or disliked about their experience at Soba.",Fusion
djNlAxJ4AWRmGykzxzcWyw,Lola's Eatery,Unknown,"Breakfast & Brunch, Cocktail Bars, Donuts",2.0,4.3,204,True,"[{'is_overnight': False, 'start': '0800', 'end': '1400', 'day': 0}, {'is_overnight': False, 'start': '0800', 'end': '1400', 'day': 2}, {'is_overnight': False, 'start': '0800', 'end': '1400', 'day': 3}, {'is_overnight': False, 'start': '0800', 'end': '1400', 'day': 4}, {'is_overnight': False, 'start': '0900', 'end': '1400', 'day': 5}, {'is_overnight': False, 'start': '0900', 'end': '1400', 'day': 6}]","Breakfast & Brunch, Cocktail Bars, Donuts","Lola's Eatery is a local spot serving up breakfast favorites, brunch specialties, and craft cocktails, with fresh donuts to satisfy your sweet tooth.","The menu features classic breakfast and brunch dishes, along with a selection of creative cocktails. Homemade donuts are a highlight.",No Yelp reviews found for this establishment.,Casual
0qBBc2K8OmZ_6D2mj8gvpg,City Winery Pittsburgh,Unknown,"Venues & Event Spaces, New American, Wine Bars",,3.7,97,True,"[{'is_overnight': False, 'start': '1600', 'end': '2200', 'day': 0}, {'is_overnight': False, 'start': '1600', 'end': '2200', 'day': 1}, {'is_overnight': False, 'start': '1600', 'end': '2200', 'day': 2}, {'is_overnight': False, 'start': '1600', 'end': '2200', 'day': 3}, {'is_overnight': False, 'start': '1600', 'end': '2200', 'day': 4}, {'is_overnight': False, 'start': '1200', 'end': '2100', 'day': 5}, {'is_overnight': False, 'start': '1200', 'end': '2100', 'day': 6}]","Venues & Event Spaces, New American, Wine Bars","City Winery Pittsburgh is a combination winery, restaurant and event venue serving New American cuisine. It offers a unique dining and entertainment experience in Pittsburgh.","The menu features New American dishes paired with a selection of wines produced on-site or from City Winery's other locations. Expect wine bar small plates, entrees and desserts.",No Yelp reviews were found for this recently opened establishment.,Upscale casual
WJcurrixJrMlG4hblzx20g,G's On Liberty,Unknown,"New American, Cocktail Bars",,4.5,56,True,"[{'is_overnight': False, 'start': '1600', 'end': '2100', 'day': 1}, {'is_overnight': False, 'start': '1600', 'end': '2100', 'day': 2}, {'is_overnight': False, 'start': '1600', 'end': '2100', 'day': 3}, {'is_overnight': False, 'start': '1600', 'end': '2200', 'day': 4}, {'is_overnight': False, 'start': '1600', 'end': '2200', 'day': 5}]","New American, Cocktail Bars",,,,
Zz2AwpjN3HA1-L_XUC5R9g,Driftwood Oven,Unknown,Pizza,2.0,4.5,312,True,"[{'is_overnight': False, 'start': '1100', 'end': '2100', 'day': 2}, {'is_overnight': False, 'start': '1100', 'end': '2100', 'day': 3}, {'is_overnight': False, 'start': '1100', 'end': '2200', 'day': 4}, {'is_overnight': False, 'start': '1100', 'end': '2200', 'day': 5}, {'is_overnight': False, 'start': '1100', 'end': '2100', 'day': 6}]",Pizza,,,,
_nHTQ6XzGRcehbdS8trwfQ,Chaykhana Pittsburgh,Unknown,"Uzbek, Halal, Kebab",,4.6,41,True,"[{'is_overnight': False, 'start': '1100', 'end': '2200', 'day': 1}, {'is_overnight': False, 'start': '1100', 'end': '2200', 'day': 2}, {'is_overnight': False, 'start': '1100', 'end': '2200', 'day': 3}, {'is_overnight': False, 'start': '1100', 'end': '2300', 'day': 4}, {'is_overnight': False, 'start': '1100', 'end': '2300', 'day': 5}, {'is_overnight': False, 'start': '1100', 'end': '2200', 'day': 6}]","Uzbek, Halal, Kebab",Chaykhana Pittsburgh is an Uzbek restaurant serving halal cuisine with a focus on kebabs. No Yelp reviews are currently available to provide additional insight into the restaurant.,"The menu centers around Uzbek halal dishes, notably featuring various kebab options. Specific menu items are unknown without available reviews or additional information.","No Yelp reviews could be found for Chaykhana Pittsburgh, so a summary of what patrons liked or disliked about their experience is not available.",Unknown
ChWvY05jAtrBzLpWSUiHQg,Rival,Unknown,"Sports Bars, Burgers, Chicken Wings",,3.6,67,True,"[{'is_overnight': False, 'start': '1100', 'end': '2300', 'day': 0}, {'is_overnight': False, 'start': '1100', 'end': '2300', 'day': 1}, {'is_overnight': False, 'start': '1100', 'end': '2300', 'day': 2}, {'is_overnight': False, 'start': '1100', 'end': '2300', 'day': 3}, {'is_overnight': False, 'start': '1100', 'end': '0000', 'day': 4}, {'is_overnight': False, 'start': '1100', 'end': '0000', 'day': 5}, {'is_overnight': False, 'start': '1100', 'end': '2200', 'day': 6}]","Sports Bars, Burgers, Chicken Wings","Rival is a sports bar serving up burgers, chicken wings and other pub fare.","The menu features classic sports bar food like burgers, chicken wings, and likely other items such as fries, onion rings, and sandwiches.",No Yelp reviews were found for this restaurant.,Sporty
rgohunOzrrrgdZcxkQzCgQ,Huszar,Unknown,"Bars, Hungarian",2.0,4.3,181,True,"[{'is_overnight': False, 'start': '1200', 'end': '2000', 'day': 1}, {'is_overnight': False, 'start': '1200', 'end': '2000', 'day': 2}, {'is_overnight': False, 'start': '1200', 'end': '2000', 'day': 3}, {'is_overnight': False, 'start': '1200', 'end': '2000', 'day': 4}, {'is_overnight': False, 'start': '1200', 'end': '2000', 'day': 5}, {'is_overnight': False, 'start': '1200', 'end': '1900', 'day': 6}]","Bars, Hungarian",Huszar is a bar serving Hungarian cuisine.,"The menu features traditional Hungarian dishes and drinks, though specifics are not available due to a lack of reviews.",No Yelp reviews could be found for this restaurant to summarize what diners liked or disliked about their experience.,Unknown
gHngt6zpP683GKe1i23LUg,Grand Concourse,Unknown,"Seafood, Cocktail Bars, Buffets",3.0,3.5,908,True,"[{'is_overnight': False, 'start': '1130', 'end': '2100', 'day': 0}, {'is_overnight': False, 'start': '1130', 'end': '2100', 'day': 1}, {'is_overnight': False, 'start': '1130', 'end': '2100', 'day': 2}, {'is_overnight': False, 'start': '1130', 'end': '2130', 'day': 3}, {'is_overnight': False, 'start': '1130', 'end': '2130', 'day': 4}, {'is_overnight': False, 'start': '1130', 'end': '2130', 'day': 5}, {'is_overnight': False, 'start': '0900', 'end': '2030', 'day': 6}]","Seafood, Cocktail Bars, Buffets","Grand Concourse is a restaurant offering seafood, cocktails, and buffet dining. No further details are available due to a lack of reviews.",The menu focuses on seafood dishes. Buffet options are available. A cocktail bar is part of the restaurant's offerings.,No reviews could be found to summarize what guests liked or disliked about their experience at Grand Concourse.,Unknown
2d9ABtvEBcGCcN6B13Fy1w,Eighth & Hays,Unknown,"Wine Bars, Pizza, Cocktail Bars",2.0,4.4,199,True,"[{'is_overnight': False, 'start': '1600', 'end': '2100', 'day': 2}, {'is_overnight': False, 'start': '1600', 'end': '2100', 'day': 3}, {'is_overnight': False, 'start': '1600', 'end': '2300', 'day': 4}, {'is_overnight': False, 'start': '1600', 'end': '2300', 'day': 5}]","Wine Bars, Pizza, Cocktail Bars",Eighth & Hays is a bar and eatery serving pizza alongside wine and cocktails.,"The menu likely features a variety of pizzas, complemented by a selection of wines and cocktails.",No reviews available to summarize what diners liked or disliked about their experience.,Insufficient information to characterize the restaurant's ambiance or vibe.
kczPF6rOv4YAFlZYeTH9gA,The Woods House Historic Pub,Unknown,"Pubs, Salad, Soup",,4.2,57,True,"[{'is_overnight': False, 'start': '1700', 'end': '2200', 'day': 2}, {'is_overnight': False, 'start': '1700', 'end': '2200', 'day': 3}, {'is_overnight': False, 'start': '1700', 'end': '2200', 'day': 4}, {'is_overnight': False, 'start': '1500', 'end': '2200', 'day': 5}]","Pubs, Salad, Soup","The Woods House Historic Pub is a pub located in a historic building, serving salads and soups.","The menu focuses on pub fare, with offerings of salads and soups.",No Yelp reviews were found for The Woods House Historic Pub.,Historic
s7tzMsHVNyTJhVoYjT8ktg,Kulcher Kitchen And Bar,Unknown,"Cocktail Bars, Tacos, Sandwiches",,4.2,20,True,"[{'is_overnight': True, 'start': '1200', 'end': '0200', 'day': 0}, {'is_overnight': True, 'start': '1200', 'end': '0200', 'day': 1}, {'is_overnight': True, 'start': '1200', 'end': '0200', 'day': 2}, {'is_overnight': True, 'start': '1200', 'end': '0200', 'day': 3}, {'is_overnight': True, 'start': '1200', 'end': '0200', 'day': 4}, {'is_overnight': True, 'start': '1200', 'end': '0200', 'day': 5}, {'is_overnight': False, 'start': '1200', 'end': '0000', 'day': 6}]","Cocktail Bars, Tacos, Sandwiches","Kulcher Kitchen And Bar is a local spot serving up cocktails, tacos, and sandwiches. No Yelp reviews are currently available to provide more details.","The menu features a selection of tacos and sandwiches, along with a bar serving cocktails.",No reviews found.,Unclear based on limited information.
Zn6la6TiMvwGza9htH0NZw,Cobra,Unknown,"Korean, Japanese, Karaoke",4.0,4.1,152,True,"[{'is_overnight': False, 'start': '1700', 'end': '2300', 'day': 2}, {'is_overnight': False, 'start': '1700', 'end': '2300', 'day': 3}, {'is_overnight': False, 'start': '1700', 'end': '0000', 'day': 4}, {'is_overnight': True, 'start': '1700', 'end': '0200', 'day': 5}, {'is_overnight': False, 'start': '1700', 'end': '2300', 'day': 6}]","Korean, Japanese, Karaoke",Cobra is a Korean and Japanese restaurant that also offers karaoke entertainment.,"The restaurant serves Korean and Japanese cuisine, but no specific menu details could be found.",No Yelp reviews were available for this restaurant.,Lively
jalA5zHW8ZfY3RSPG7oDxQ,Cafe Du Jour,Unknown,"French, Modern European",2.0,4.6,260,True,"[{'is_overnight': False, 'start': '1500', 'end': '2100', 'day': 3}, {'is_overnight': False, 'start': '1500', 'end': '2100', 'day': 4}, {'is_overnight': False, 'start': '1500', 'end': '2100', 'day': 5}]","French, Modern European",Cafe Du Jour is a French and modern European restaurant. No further details could be found as there were no reviews available on Yelp.,"The menu likely features French and modern European cuisine, but specifics are unknown due to the lack of reviews and information.","No reviews were found on Yelp for Cafe Du Jour, so it's unclear what diners liked or disliked about their experiences at this restaurant.",Unknown
CLCumtBtaxl5ziuycMDkAg,Refucilo Winery,Unknown,"Wine Tasting Room, Tapas Bars",,4.9,61,True,"[{'is_overnight': False, 'start': '1700', 'end': '2200', 'day': 2}, {'is_overnight': False, 'start': '1700', 'end': '2200', 'day': 3}, {'is_overnight': False, 'start': '1700', 'end': '2200', 'day': 4}, {'is_overnight': False, 'start': '1400', 'end': '2200', 'day': 5}]","Wine Tasting Room, Tapas Bars",Refucilo Winery is a wine tasting room and tapas bar. It offers a place to sample wines and enjoy small plate dishes.,The menu focuses on wine tasting flights and tapas-style small plates and appetizers to accompany the wines. Specific menu items are not available due to a lack of reviews.,"No Yelp reviews could be found for Refucilo Winery, so a summary of what reviewers liked or disliked is not available.",Sophisticated
HG3ROmv3FJZTMJPpThSXOw,Luke Wholey's Wild Alaskan Grille,Unknown,"Seafood, Sushi Bars, Cocktail Bars",2.0,3.9,673,True,"[{'is_overnight': False, 'start': '1200', 'end': '2030', 'day': 1}, {'is_overnight': False, 'start': '1200', 'end': '2030', 'day': 2}, {'is_overnight': False, 'start': '1200', 'end': '2030', 'day': 3}, {'is_overnight': False, 'start': '1100', 'end': '2200', 'day': 4}, {'is_overnight': False, 'start': '1100', 'end': '2200', 'day': 5}, {'is_overnight': False, 'start': '1100', 'end': '1800', 'day': 6}]","Seafood, Sushi Bars, Cocktail Bars",Luke Wholey's Wild Alaskan Grille is a seafood restaurant that also features a sushi bar and cocktails.,"The menu focuses on fresh seafood dishes, including sushi offerings. A full bar serves cocktails to complement the fare.",No Yelp reviews were found to summarize the diners' experiences and opinions about Luke Wholey's Wild Alaskan Grille.,Insufficient information
QqjBOEE-gOuGWelG59xQpQ,EYV Restaurant,Unknown,"Venues & Event Spaces, Fruits & Veggies, Vegetarian",,4.7,44,True,"[{'is_overnight': False, 'start': '1730', 'end': '2130', 'day': 1}, {'is_overnight': False, 'start': '1730', 'end': '2130', 'day': 2}, {'is_overnight': False, 'start': '1730', 'end': '2130', 'day': 3}, {'is_overnight': False, 'start': '1730', 'end': '2130', 'day': 4}, {'is_overnight': False, 'start': '1730', 'end': '2130', 'day': 5}]","Venues & Event Spaces, Fruits & Veggies, Vegetarian",EYV Restaurant is a vegetarian-friendly venue and event space.,The restaurant serves vegetarian cuisine with a focus on fresh fruits and vegetables.,No Yelp reviews found for this restaurant.,Vegetarian-focused
SFRuPnpK0GJWTlaenDKpyg,Ocha Thai Noodle,Unknown,Noodles,,3.9,48,True,"[{'is_overnight': True, 'start': '1300', 'end': '0130', 'day': 0}, {'is_overnight': True, 'start': '1300', 'end': '0130', 'day': 1}, {'is_overnight': True, 'start': '1300', 'end': '0130', 'day': 2}, {'is_overnight': True, 'start': '1300', 'end': '0230', 'day': 3}, {'is_overnight': True, 'start': '1300', 'end': '0230', 'day': 4}, {'is_overnight': True, 'start': '1300', 'end': '0230', 'day': 5}, {'is_overnight': True, 'start': '1300', 'end': '0130', 'day': 6}]",Noodles,Ocha Thai Noodle is a restaurant specializing in Thai-style noodle dishes.,The menu focuses on various Thai noodle dishes and soups. Specific menu items are unknown due to lack of available reviews or information.,"No Yelp reviews were found for this restaurant, so reviewer opinions and experiences are unavailable.",Unknown
id0K2DhGNocMRMoBcvCsyg,Senyai Thai Kitchen,Unknown,"Thai, Seafood, Noodles",2.0,4.5,362,True,"[{'is_overnight': False, 'start': '1200', 'end': '1530', 'day': 0}, {'is_overnight': False, 'start': '1630', 'end': '2100', 'day': 0}, {'is_overnight': False, 'start': '1200', 'end': '1530', 'day': 1}, {'is_overnight': False, 'start': '1630', 'end': '2100', 'day': 1}, {'is_overnight': False, 'start': '1200', 'end': '1530', 'day': 3}, {'is_overnight': False, 'start': '1630', 'end': '2100', 'day': 3}, {'is_overnight': False, 'start': '1200', 'end': '1530', 'day': 4}, {'is_overnight': False, 'start': '1630', 'end': '2100', 'day': 4}, {'is_overnight': False, 'start': '1200', 'end': '1530', 'day': 5}, {'is_overnight': False, 'start': '1630', 'end': '2100', 'day': 5}, {'is_overnight': False, 'start': '1600', 'end': '2100', 'day': 6}]","Thai, Seafood, Noodles",Senyai Thai Kitchen is a Thai restaurant specializing in seafood and noodle dishes.,The menu focuses on Thai cuisine with an emphasis on seafood and noodle-based dishes. Specific menu items are unknown.,"No Yelp reviews were found for this restaurant, so reviewer opinions are unavailable.",Unknown
z15C-dJodOlPO8bMBl6F8g,Bar Marco,Unknown,"Wine Bars, Cafes, Italian",2.0,4.0,379,True,"[{'is_overnight': False, 'start': '1700', 'end': '2100', 'day': 1}, {'is_overnight': False, 'start': '1700', 'end': '2100', 'day': 2}, {'is_overnight': False, 'start': '1700', 'end': '2100', 'day': 3}, {'is_overnight': False, 'start': '1700', 'end': '2100', 'day': 4}, {'is_overnight': False, 'start': '1700', 'end': '2100', 'day': 5}]","Wine Bars, Cafes, Italian",,,,
oYb167NqBXJ9uKkKn_Gv-A,Bombay To Burgh,Unknown,Indian,,4.7,119,True,"[{'is_overnight': False, 'start': '1400', 'end': '2130', 'day': 1}, {'is_overnight': False, 'start': '1100', 'end': '2130', 'day': 2}, {'is_overnight': False, 'start': '1100', 'end': '2130', 'day': 3}, {'is_overnight': False, 'start': '1100', 'end': '2130', 'day': 4}, {'is_overnight': False, 'start': '1100', 'end': '2130', 'day': 5}, {'is_overnight': False, 'start': '1100', 'end': '1600', 'day': 6}]",Indian,,,,
B7pcNWBNTXl4WZ22Y-2x6A,Coughlin's Law Kitchen and Ale House,Unknown,"New American, Burgers, Cocktail Bars",2.0,3.8,379,True,"[{'is_overnight': False, 'start': '1130', 'end': '0000', 'day': 0}, {'is_overnight': False, 'start': '1130', 'end': '0000', 'day': 1}, {'is_overnight': False, 'start': '1130', 'end': '0000', 'day': 2}, {'is_overnight': False, 'start': '1130', 'end': '0000', 'day': 3}, {'is_overnight': False, 'start': '1130', 'end': '0000', 'day': 4}, {'is_overnight': False, 'start': '1000', 'end': '0000', 'day': 5}, {'is_overnight': False, 'start': '1000', 'end': '2200', 'day': 6}]","New American, Burgers, Cocktail Bars",Coughlin's Law Kitchen and Ale House is a New American restaurant and bar serving up burgers and cocktails.,The menu features New American cuisine with a focus on burgers. A full bar serves up cocktails.,No Yelp reviews were found for this restaurant.,Casual
otJmsevA4oNKESiBNCZsXQ,Shiloh Gastro,Unknown,New American,2.0,4.1,87,True,"[{'is_overnight': False, 'start': '1600', 'end': '2200', 'day': 0}, {'is_overnight': False, 'start': '1600', 'end': '2200', 'day': 1}, {'is_overnight': False, 'start': '1600', 'end': '2200', 'day': 2}, {'is_overnight': False, 'start': '1600', 'end': '2200', 'day': 3}, {'is_overnight': False, 'start': '1200', 'end': '2300', 'day': 4}, {'is_overnight': False, 'start': '1100', 'end': '2300', 'day': 5}, {'is_overnight': False, 'start': '1100', 'end': '2200', 'day': 6}]",New American,,,,
